2018-12-06 20:07:58,2018-12-06 20:12:08,IP Address,137.49.182.75,100,249,True,2018-12-06 20:12:08,R_xEs4K8IAMfJ7Vw5,,,,,41.7899932861328125,-72.745697021484375,anonymous,EN,Practitioner,Completely Satisfied,Completely Satisfied,Collaboration,nothing so far,Completely Satisfied,Completely Satisfied,discourse,nothing so far,Completely Satisfied,Completely Satisfied,"presentation, discourse",nothing so far,Completely Satisfied,activity and discourse,nothing so far,Completely Satisfied,Completely Satisfied,nothing so far,activities and discourse,Strongly Agree,Strongly Agree
2018-12-06 20:05:36,2018-12-06 20:12:12,IP Address,137.49.138.34,100,396,True,2018-12-06 20:12:13,R_33lHdM13k02HJx3,,,,,41.7899932861328125,-72.745697021484375,anonymous,EN,Practitioner,Neutral,Moderately Satisfied,"I appreciated the language of Data Wise being a process that supports what we already do in our schools rather than a ""program."" ",I would have benefited from seeing the Michael Jr. clip at the beginning of today's session to give some context to our work today. I experienced dissonance around what activity/task we were doing and why we were doing it. The big picture wasn't clear to me. Can you provide a graphic organizer or note-catcher to help align the activities to the purpose? I am sorry. I just need the presentations to be a bit more organized to the purpose.,Neutral,Neutral,,,Neutral,Neutral,,,Moderately Satisfied,The time to practice engaging in a meeting.,Provide the online documents/tools in advance so that everyone already has access.,Moderately Satisfied,Neutral,,,Neutral,Neutral
2018-12-06 20:06:16,2018-12-06 20:12:15,IP Address,137.49.111.112,100,358,True,2018-12-06 20:12:15,R_1mloW9p99jhfBOj,,,,,41.7899932861328125,-72.745697021484375,anonymous,EN,Practitioner,Completely Dissatisfied,Completely Dissatisfied,"Setting the tone and the purpose of our work as an organization, aligned to our DME","Tiering of learning based on where the participants are ",Completely Dissatisfied,Completely Dissatisfied,,,Completely Dissatisfied,Completely Dissatisfied,,,Moderately Dissatisfied,,"It was hard to be participate in a meeting whose agenda you're not familiar with ",Completely Dissatisfied,Completely Dissatisfied,,Knowing what impacts the assessments our students are taking and their data,Strongly Agree,Strongly Agree
2018-12-06 20:06:18,2018-12-06 20:12:15,IP Address,137.49.65.237,100,357,True,2018-12-06 20:12:15,R_10T0VvJmsR4aoZQ,,,,,41.7899932861328125,-72.745697021484375,anonymous,EN,Practitioner,Moderately Satisfied,Moderately Satisfied,"I got a general idea of what we were going to learn about. ",It raised a lot of questions about how it applied to my school.,Completely Satisfied,Completely Satisfied,Focused and intentional instruction,The example was about a whole school goal and it wasn't clear what you would do as a small school with an academically diverse student body.,Moderately Dissatisfied,Moderately Dissatisfied,Moved along well,"Seemed like she was talking ""nice"" and not thoughtfully.",Neutral,We got to know each other better.,There needs to be some goal that applies to all schools.,Completely Satisfied,Completely Satisfied,Nothing,Max did a great job.,Strongly Agree,Neutral
2018-12-06 20:06:26,2018-12-06 20:12:31,IP Address,137.49.142.72,100,364,True,2018-12-06 20:12:31,R_3EVZnvuLpLw8SEM,,,,,41.7899932861328125,-72.745697021484375,anonymous,EN,Practitioner,Completely Satisfied,Completely Satisfied,well-timed,N/A,Completely Satisfied,Completely Satisfied,"well-timed, BART example",N/A,Completely Satisfied,Completely Satisfied,"well-timed, compass points",N/A,Completely Satisfied,needed opportunity to think/talk about how exactly we are going to implement this; support from Rob and Max was key,N/A,Completely Satisfied,,use visuals to show definitions of concepts,divorce and margarin graph; explaining to each other,Somewhat Agree,Somewhat Agree
2018-12-06 20:07:55,2018-12-06 20:12:44,IP Address,137.49.138.75,100,289,True,2018-12-06 20:12:45,R_3iJ4kXi1W0vX9S8,,,,,41.7899932861328125,-72.745697021484375,anonymous,EN,Practitioner,Completely Satisfied,Completely Satisfied,WORKING TOGETHER WITH THE GROUP THAT WILL CONTINUE THE WORK BACK AT THE BUILDING,FEWER PEOPLE A BIT CROWDED WITH 10 AT OURS!,Completely Satisfied,Completely Satisfied,KOWLEDGEABLE PRESENTERS,TOO CROWDED,Completely Satisfied,Completely Satisfied,NICE TO MOVE AROUND AND HAVE A BIT OF FUN.,"TOO CROWDED! ",Completely Satisfied,NICE TO HAVE THE TIME TO APPLY WHAT WE ARELEARNING ON THE SPOT.,,,,,,Neutral,Neutral
2018-12-06 20:10:45,2018-12-06 20:13:40,IP Address,174.199.90.139,100,175,True,2018-12-06 20:13:41,R_3QLsDfwrSWOV8N0,,,,,37.751007080078125,-97.82199859619140625,anonymous,EN,Practitioner,Completely Satisfied,Completely Satisfied,Interactive sessions,N/a,Completely Satisfied,Completely Satisfied,Practical examples,N/a,Completely Satisfied,Completely Satisfied,All,N/a,Completely Satisfied,All,N/a,Completely Satisfied,Completely Satisfied,All,Nothing,Strongly Agree,Strongly Agree
2018-12-06 20:07:19,2018-12-06 20:13:55,IP Address,137.49.183.163,100,396,True,2018-12-06 20:13:56,R_BR4kKYSBLyG7szf,,,,,41.7899932861328125,-72.745697021484375,anonymous,EN,Practitioner,Completely Satisfied,Moderately Satisfied,Groups work and going through the process as a group.,More time to complete tasks and more collaborative work to apply learning.,Completely Satisfied,Moderately Satisfied,same as above,same as above,Completely Satisfied,Completely Satisfied,same as above,,Neutral,walking through the process,More clarity with expectation,Completely Satisfied,Moderately Satisfied,the organizer with the reading ahead of time,,Somewhat Agree,Somewhat Agree
