StartDate,EndDate,Status,IPAddress,Progress,Duration (in seconds),Finished,RecordedDate,ResponseId,RecipientLastName,RecipientFirstName,RecipientEmail,ExternalReference,LocationLatitude,LocationLongitude,DistributionChannel,UserLanguage,Q2,Q4_1,Q4_2,Q5,Q6,Q7_1,Q7_2,Q8,Q9,Q10_1,Q10_2,Q11,Q12,Q13_1,Q14,Q15,Q16_1,Q16_2,Q17,Q18,Q20,Q21
Start Date,End Date,Response Type,IP Address,Progress,Duration (in seconds),Finished,Recorded Date,Response ID,Recipient Last Name,Recipient First Name,Recipient Email,External Data Reference,Location Latitude,Location Longitude,Distribution Channel,User Language,What is your role?,[Faculty Session] Setting the Context & The Purpose of Data Wise (Jorge Peña and Kim Frumin) - Importance of Topic,[Faculty Session] Setting the Context & The Purpose of Data Wise (Jorge Peña and Kim Frumin) - Quality of Instruction,What worked well about this session?,What would you have liked to change about this session?,[Faculty Session] Continuous Improvement Cycles (Jorge Peña) - Importance of Topic,[Faculty Session] Continuous Improvement Cycles (Jorge Peña) - Quality of Instruction,What worked well about this session?,What would you have liked to change about this session?,"[Faculty Session] Step 1: Organizing for Collaborative Work (Donna Drakeford)In this session, we set norms, did the equity reflection protocol, and reviewed the schedule for the week. - Importance of Topic","[Faculty Session] Step 1: Organizing for Collaborative Work (Donna Drakeford)In this session, we set norms, did the equity reflection protocol, and reviewed the schedule for the week. - Quality of Instruction",What worked well about this session?,What would you have liked to change about this session?,"[Team Session] Organizing for Collaborative Work (Team Time)

In this session we created our team rolling agenda and ""played along"" with using Meeting Wise practices. - Value of Session",What worked well about this session?,What would you have liked to change about this session?,"[Faculty Session] Step 2: Building Assessment Literacy (Max Yurkofsky)In this session, we discussed how assessments shine a light
on student skills and knowledge and we practiced applying responsible
assessment literacy practices in a variety of examples. - Importance of Topic","[Faculty Session] Step 2: Building Assessment Literacy (Max Yurkofsky)In this session, we discussed how assessments shine a light
on student skills and knowledge and we practiced applying responsible
assessment literacy practices in a variety of examples. - Quality of Instruction",What would you have liked to change about this session?,What worked well about this session?,"Today's sessions helped me articulate how and why equity is central to the work of
school improvement.",Today's sessions helped me build understanding and skills to use Data Wise tools to foster equitable practices at each step of the improvement process.
"{""ImportId"":""startDate"",""timeZone"":""Z""}","{""ImportId"":""endDate"",""timeZone"":""Z""}","{""ImportId"":""status""}","{""ImportId"":""ipAddress""}","{""ImportId"":""progress""}","{""ImportId"":""duration""}","{""ImportId"":""finished""}","{""ImportId"":""recordedDate"",""timeZone"":""Z""}","{""ImportId"":""_recordId""}","{""ImportId"":""recipientLastName""}","{""ImportId"":""recipientFirstName""}","{""ImportId"":""recipientEmail""}","{""ImportId"":""externalDataReference""}","{""ImportId"":""locationLatitude""}","{""ImportId"":""locationLongitude""}","{""ImportId"":""distributionChannel""}","{""ImportId"":""userLanguage""}","{""ImportId"":""QID1""}","{""ImportId"":""QID42_1""}","{""ImportId"":""QID42_2""}","{""ImportId"":""QID43_TEXT""}","{""ImportId"":""QID44_TEXT""}","{""ImportId"":""QID51_1""}","{""ImportId"":""QID51_2""}","{""ImportId"":""QID46_TEXT""}","{""ImportId"":""QID47_TEXT""}","{""ImportId"":""QID48_1""}","{""ImportId"":""QID48_2""}","{""ImportId"":""QID52_TEXT""}","{""ImportId"":""QID53_TEXT""}","{""ImportId"":""QID59_1""}","{""ImportId"":""QID60_TEXT""}","{""ImportId"":""QID61_TEXT""}","{""ImportId"":""QID67_1""}","{""ImportId"":""QID67_2""}","{""ImportId"":""QID70_TEXT""}","{""ImportId"":""QID69_TEXT""}","{""ImportId"":""QID21""}","{""ImportId"":""QID65""}"
2018-12-06 19:58:25,2018-12-06 20:01:34,IP Address,137.49.156.142,100,189,True,2018-12-06 20:01:34,R_OJN3kYBct8GqhcB,,,,,41.7899932861328125,-72.745697021484375,anonymous,EN,Practitioner,Completely Satisfied,Completely Satisfied,"Organization, supplemental activities, and resources ",,Completely Satisfied,Completely Satisfied,,,Completely Satisfied,Completely Satisfied,,,Completely Satisfied,,,Completely Satisfied,Completely Satisfied,,,Strongly Agree,Somewhat Agree
2018-12-06 19:56:39,2018-12-06 20:02:48,IP Address,137.49.64.41,100,368,True,2018-12-06 20:02:48,R_28J2HPWs8wYurxT,,,,,41.7899932861328125,-72.745697021484375,anonymous,EN,Teaching Fellow,Moderately Satisfied,Neutral,"The flow and pace of the day.  ","Less fluff (like the North, South activity) and more learning with application time.",Moderately Satisfied,Moderately Satisfied,,,,,,"The activity (North, South)",Completely Satisfied,Having the chance to plan together was the best part of the day.,More opportunities to apply learning throughout the day like this one.,Moderately Satisfied,Moderately Satisfied,,,Somewhat Agree,Somewhat Agree
2018-12-06 20:06:05,2018-12-06 20:07:01,IP Address,137.49.64.201,100,56,True,2018-12-06 20:07:02,R_1n2T0kqapsaLCLa,,,,,41.7899932861328125,-72.745697021484375,anonymous,EN,Practitioner,Completely Satisfied,Completely Satisfied,,,Completely Satisfied,Completely Satisfied,,,Completely Satisfied,Completely Satisfied,,,Completely Satisfied,,,Completely Satisfied,Completely Satisfied,,,Strongly Agree,Strongly Agree
2018-12-06 20:04:36,2018-12-06 20:07:09,IP Address,137.49.182.170,100,153,True,2018-12-06 20:07:09,R_2ayLgbQX5yQRCNR,,,,,41.7899932861328125,-72.745697021484375,anonymous,EN,Practitioner,Completely Satisfied,Completely Satisfied,,,Moderately Satisfied,Moderately Satisfied,,,Moderately Satisfied,Moderately Satisfied,,,Completely Satisfied,clear expectations and models,,Moderately Satisfied,Moderately Satisfied,,,Strongly Agree,Strongly Agree
2018-12-06 19:59:31,2018-12-06 20:07:10,IP Address,137.49.131.14,100,459,True,2018-12-06 20:07:10,R_oZydnd4xskqNM6l,,,,,41.7899932861328125,-72.745697021484375,anonymous,EN,Practitioner,Neutral,Neutral,Transitions,More modeling and direction,Neutral,Neutral,Transitions,More modeling,Neutral,Neutral,Transitions,More modeling,Neutral,Transitions,More modeling,Neutral,Neutral,More modeling,Transitions,Neutral,Neutral
2018-12-06 20:06:28,2018-12-06 20:07:29,IP Address,174.199.2.158,100,61,True,2018-12-06 20:07:30,R_cSmSrYChnz2PTtn,,,,,41.5381927490234375,-72.80699920654296875,anonymous,EN,Practitioner,Moderately Satisfied,,,,Moderately Satisfied,,,,Moderately Satisfied,,,,Moderately Satisfied,,,Moderately Satisfied,Moderately Satisfied,,,Somewhat Agree,Somewhat Agree
2018-12-06 20:06:04,2018-12-06 20:07:32,IP Address,137.49.140.212,100,88,True,2018-12-06 20:07:33,R_1Kjpx6uWnxpKPOb,,,,,41.7899932861328125,-72.745697021484375,anonymous,EN,Practitioner,Completely Satisfied,Completely Satisfied,,,Completely Satisfied,Completely Satisfied,,,Completely Satisfied,Completely Satisfied,,,Completely Satisfied,,,Completely Satisfied,Completely Satisfied,,,Strongly Agree,Somewhat Agree
2018-12-06 20:05:56,2018-12-06 20:07:43,IP Address,174.199.20.127,100,106,True,2018-12-06 20:07:43,R_23WusPRnq1bBFMM,,,,,41.5381927490234375,-72.80699920654296875,anonymous,EN,Practitioner,Moderately Satisfied,Moderately Satisfied,"Working sessions ","Nothing ",Moderately Satisfied,Moderately Satisfied,Talking about where we are as a school at the two steps,Nothing,Completely Satisfied,Completely Satisfied,,,Moderately Satisfied,,,Moderately Satisfied,Moderately Satisfied,,,Strongly Agree,Strongly Agree
2018-12-06 20:06:17,2018-12-06 20:07:52,IP Address,174.199.87.109,100,95,True,2018-12-06 20:07:52,R_269Flr96AfyZ4Oe,,,,,42.3583984375,-71.0597991943359375,anonymous,EN,Practitioner,Moderately Satisfied,Moderately Satisfied,,I would have liked to join the process rather than observing,Moderately Satisfied,Moderately Satisfied,,,Moderately Satisfied,Moderately Satisfied,,,Moderately Satisfied,,,Moderately Satisfied,Moderately Satisfied,,,Somewhat Agree,Somewhat Agree
2018-12-06 20:05:53,2018-12-06 20:07:56,IP Address,174.199.29.51,100,122,True,2018-12-06 20:07:56,R_syZDwp6XzQAKC53,,,,,42.3583984375,-71.0597991943359375,anonymous,EN,Practitioner,Completely Satisfied,Completely Satisfied,I enjoyed getting to meet and discuss the topics with other educators in my district.,I’d like there to be more modeling/videos to show the process in action,Completely Satisfied,Completely Satisfied,,,Completely Satisfied,Completely Satisfied,,,Completely Satisfied,,,Completely Satisfied,Completely Satisfied,,,Strongly Agree,Strongly Agree
2018-12-06 20:06:59,2018-12-06 20:07:56,IP Address,137.49.109.48,100,56,True,2018-12-06 20:07:56,R_1Qsa6HUuQ9KnYSP,,,,,41.7899932861328125,-72.745697021484375,anonymous,EN,Practitioner,Neutral,Neutral,talking as a group,,Moderately Satisfied,Moderately Satisfied,,,Moderately Satisfied,Moderately Satisfied,,,Moderately Satisfied,,,Moderately Satisfied,Moderately Satisfied,,,Somewhat Agree,Somewhat Agree
2018-12-06 20:05:48,2018-12-06 20:08:04,IP Address,137.49.141.240,100,136,True,2018-12-06 20:08:05,R_SUUZXAd4RAIJLTX,,,,,41.7899932861328125,-72.745697021484375,anonymous,EN,Practitioner,Completely Satisfied,Completely Satisfied,,"Differentiate based upon schools experience and successful implementation of the Data Wise process. ",Completely Satisfied,Completely Satisfied,,,Completely Satisfied,Completely Satisfied,,,Completely Satisfied,,,Completely Satisfied,Completely Satisfied,,,Somewhat Agree,Somewhat Agree
2018-12-06 20:05:56,2018-12-06 20:08:09,IP Address,174.199.27.145,100,132,True,2018-12-06 20:08:09,R_2WMxF47ZRe4fcdx,,,,,41.82000732421875,-71.415802001953125,anonymous,EN,Practitioner,Moderately Satisfied,Moderately Satisfied,,,Neutral,Neutral,,,Neutral,Neutral,,,Moderately Satisfied,"Appreciated the time to practice with our team. Agenda was strong and helped to surface the work ahead. ",,Neutral,Neutral,,,Somewhat Agree,Somewhat Agree
2018-12-06 20:06:14,2018-12-06 20:08:14,IP Address,174.199.0.134,100,120,True,2018-12-06 20:08:14,R_2Uh1T5OzjL8ImSO,,,,,41.5381927490234375,-72.80699920654296875,anonymous,EN,Practitioner,Moderately Satisfied,Neutral,"Good mix of whole group & team time ",Differentiation for schools already engaged in process,Neutral,Neutral,,,,,,,,,,,,,,Neutral,Neutral
2018-12-06 20:07:16,2018-12-06 20:08:15,IP Address,137.49.150.219,100,58,True,2018-12-06 20:08:15,R_1hA0IrgDOOWRs9H,,,,,41.7899932861328125,-72.745697021484375,anonymous,EN,Practitioner,Completely Satisfied,Completely Satisfied,,,Completely Satisfied,Completely Satisfied,,,Completely Satisfied,Completely Satisfied,,,Completely Satisfied,,,Completely Satisfied,Completely Satisfied,,,Strongly Agree,Strongly Agree
2018-12-06 20:06:11,2018-12-06 20:08:15,IP Address,137.49.150.14,100,124,True,2018-12-06 20:08:16,R_3eaVPt09BZk3iAV,,,,,41.7899932861328125,-72.745697021484375,anonymous,EN,Practitioner,Neutral,Neutral,,,Neutral,Neutral,,,Neutral,Neutral,,,Moderately Dissatisfied,,,Neutral,Neutral,,,Neutral,Neutral
2018-12-06 19:59:47,2018-12-06 20:08:17,IP Address,137.49.131.94,100,510,True,2018-12-06 20:08:18,R_3m8lkDOkYMTOdeO,,,,,41.7899932861328125,-72.745697021484375,anonymous,EN,Practitioner,Completely Satisfied,Completely Satisfied,Time for individual school teams to work and learn together.,,Completely Satisfied,Completely Satisfied,,,Completely Satisfied,Completely Satisfied,,,Completely Satisfied,,,Completely Satisfied,Moderately Satisfied,Parts of this section were confusing as presented.,,Neutral,Neutral
2018-12-06 20:06:33,2018-12-06 20:08:28,IP Address,137.49.183.136,100,115,True,2018-12-06 20:08:29,R_3qOqDA5CbrtH2h7,,,,,41.7899932861328125,-72.745697021484375,anonymous,EN,Practitioner,Completely Satisfied,Completely Satisfied,Both the learning and doing,This is more school-based coming with a clearer picture of how/when bringing back,Completely Satisfied,Completely Satisfied,,,Completely Satisfied,Completely Satisfied,,,Completely Satisfied,,,Completely Satisfied,Completely Satisfied,,,Strongly Agree,Strongly Agree
2018-12-06 20:06:05,2018-12-06 20:08:31,IP Address,137.49.151.250,100,146,True,2018-12-06 20:08:31,R_56XnxfSjesOw0Ip,,,,,41.7899932861328125,-72.745697021484375,anonymous,EN,Practitioner,Completely Satisfied,Completely Satisfied,Variety of activities,More time for team collaboration,Completely Satisfied,Completely Satisfied,Clarity of explanations,More time for team collaboration,Completely Satisfied,Completely Satisfied,,,Completely Satisfied,,,Completely Satisfied,Completely Satisfied,,,Somewhat Agree,Somewhat Agree
2018-12-06 20:05:48,2018-12-06 20:08:32,IP Address,107.77.226.209,100,164,True,2018-12-06 20:08:32,R_28Ymd9ciurrsc5b,,,,,40.766693115234375,-73.8240966796875,anonymous,EN,Teaching Fellow,Moderately Satisfied,Moderately Satisfied,"I liked the time we had to work with our team and have great discussions about our  school ","N/A for now ",Moderately Satisfied,Moderately Satisfied,,,Moderately Satisfied,Moderately Satisfied,,,Moderately Satisfied,,,Moderately Satisfied,Moderately Satisfied,,,Strongly Agree,Strongly Agree
2018-12-06 20:05:41,2018-12-06 20:08:33,IP Address,174.199.89.202,100,172,True,2018-12-06 20:08:33,R_3p2PdsaxUNpTR95,,,,,37.751007080078125,-97.82199859619140625,anonymous,EN,Practitioner,Moderately Satisfied,Completely Satisfied,N/A,"When applicable, more time to discuss topics with peers.",Completely Satisfied,Completely Satisfied,,,Completely Satisfied,Completely Satisfied,Being able to have work time with our team.,,Completely Dissatisfied,Beating able to collaborate with team members.,,Moderately Satisfied,Moderately Satisfied,,,Strongly Agree,Somewhat Agree
2018-12-06 20:06:08,2018-12-06 20:08:42,IP Address,66.87.124.22,100,153,True,2018-12-06 20:08:42,R_1k2qHZuDvp0NIuD,,,,,42.2917938232421875,-71.0717010498046875,anonymous,EN,Practitioner,Completely Satisfied,Completely Satisfied,"Balance between lecture & interactive team time. ","More facilitated team time. ",Completely Satisfied,Completely Satisfied,,,Completely Satisfied,Completely Satisfied,,,Completely Satisfied,,,Moderately Dissatisfied,Moderately Satisfied,,,Strongly Agree,
2018-12-06 20:05:24,2018-12-06 20:08:45,IP Address,137.49.183.172,100,200,True,2018-12-06 20:08:45,R_bKp8IOZz4jyjjTr,,,,,41.7899932861328125,-72.745697021484375,anonymous,EN,Practitioner,Moderately Satisfied,Moderately Satisfied,Having time to work with our team on the process,A little more of an overview of what Data Wise is,Moderately Satisfied,Moderately Satisfied,Team time,More videos to see it in action,Moderately Satisfied,Moderately Satisfied,COmpass points and reflecting on our own styles,More examples of how to build a collaborative culture,Completely Satisfied,Clearly delineated roles and tasks,Nothing,Moderately Satisfied,Moderately Satisfied,"More examples of reliability, reliability, etc. and a connection to our own assessments",examples,Strongly Agree,Somewhat Agree
2018-12-06 20:06:26,2018-12-06 20:08:46,IP Address,107.77.223.78,100,140,True,2018-12-06 20:08:46,R_1meBj3q2WFSEIaL,,,,,40.77630615234375,-73.95290374755859375,anonymous,EN,Practitioner,Moderately Satisfied,Moderately Satisfied,"Time to reflect ",,Moderately Satisfied,Moderately Satisfied,"  ","   ",Moderately Satisfied,Moderately Satisfied,,,Moderately Satisfied,,,Moderately Satisfied,Moderately Satisfied,Learning it with our own assessments in front of us,,Somewhat Agree,Somewhat Agree
2018-12-06 20:06:50,2018-12-06 20:08:47,IP Address,137.49.142.224,100,116,True,2018-12-06 20:08:47,R_2ZCuNfQAUyXXQmo,,,,,41.7899932861328125,-72.745697021484375,anonymous,EN,Practitioner,Moderately Satisfied,Moderately Satisfied,,,Moderately Satisfied,Moderately Satisfied,,,Moderately Satisfied,Moderately Satisfied,,,Moderately Satisfied,,,Moderately Satisfied,Moderately Satisfied,,,Strongly Agree,Strongly Agree
2018-12-06 20:06:05,2018-12-06 20:08:50,IP Address,66.87.124.233,100,165,True,2018-12-06 20:08:50,R_b91pmxfn5MHaNah,,,,,42.2917938232421875,-71.0717010498046875,anonymous,EN,Practitioner,Moderately Satisfied,Moderately Satisfied,Very timely and organized,"N.A. ",Moderately Satisfied,,,,Completely Satisfied,,"Liked the compass activity ","N.A. ",Neutral,"Organization ",Slightly unclear directions or quickly stated,Moderately Satisfied,Moderately Satisfied,,,Strongly Agree,Strongly Agree
2018-12-06 20:05:48,2018-12-06 20:08:54,IP Address,107.77.223.194,100,185,True,2018-12-06 20:08:55,R_2QF0y1YuU544yu4,,,,,40.77630615234375,-73.95290374755859375,anonymous,EN,Practitioner,Moderately Satisfied,Completely Satisfied,"Quick overview of information was beneficial ",,Completely Satisfied,Completely Satisfied,,,Completely Satisfied,Completely Satisfied,,,Moderately Satisfied,Time to work was extremely beneficial and the PowerPoint outline and meetingsise agenda were straight forward and helpful,"We would have liked more time for this ",Completely Satisfied,Completely Satisfied,,,Strongly Agree,Strongly Agree
2018-12-06 20:05:32,2018-12-06 20:09:00,IP Address,66.87.124.197,100,207,True,2018-12-06 20:09:00,R_qL2rSv9LChsPfWh,,,,,42.2917938232421875,-71.0717010498046875,anonymous,EN,Practitioner,Completely Satisfied,Moderately Satisfied,Time management,N/a,Completely Satisfied,Completely Satisfied,I understood the content,N/A,Completely Satisfied,Completely Satisfied,Everything - particularly the compass protocol,N/A,Completely Satisfied,"Time, collaboration ","More time dedicated to team time ",Neutral,Moderately Satisfied,More definitions provided,"Time to debrief with my team. ",Somewhat Agree,Somewhat Agree
2018-12-06 20:06:31,2018-12-06 20:09:04,IP Address,137.49.146.174,100,152,True,2018-12-06 20:09:04,R_3Dbbv5BY8LllJdW,,,,,41.7899932861328125,-72.745697021484375,anonymous,EN,Practitioner,Completely Satisfied,Completely Satisfied,,,Completely Satisfied,Completely Satisfied,,,Completely Satisfied,Completely Satisfied,,,Moderately Satisfied,,We could have used more time!,Moderately Satisfied,Moderately Satisfied,,The presentation felt a bit rushed.,Strongly Agree,Strongly Agree
2018-12-06 20:06:07,2018-12-06 20:09:09,IP Address,137.49.109.110,100,182,True,2018-12-06 20:09:10,R_27r4LGi2cqkPLqW,,,,,41.7899932861328125,-72.745697021484375,anonymous,EN,Practitioner,Completely Satisfied,Completely Satisfied,"It was organized, efficient, and informative. ",Nothing,Completely Satisfied,Completely Satisfied,"The visuals helped  and the time to talk to colleagues. ",,Completely Satisfied,Completely Satisfied,,,Completely Satisfied,"I appreciated having the time to work with peers and planning next steps. ","Nothing. ",Completely Satisfied,Completely Satisfied,"Nothing. ","It was helpful having time to review concepts with colleagues. ",Strongly Agree,Strongly Agree
2018-12-06 20:05:53,2018-12-06 20:09:10,IP Address,174.199.24.164,100,196,True,2018-12-06 20:09:10,R_2VKj0OhaPR9vV0U,,,,,41.5381927490234375,-72.80699920654296875,anonymous,EN,Practitioner,Completely Satisfied,Completely Satisfied,,,Completely Satisfied,Completely Satisfied,,,Completely Satisfied,Completely Satisfied,"Identifying compass points, primary and secondary and identifying our own limitations",,Completely Satisfied,"Practice with meeting process in meaningful way to give us more information ",,Completely Satisfied,Completely Satisfied,,,Somewhat Agree,Somewhat Agree
2018-12-06 20:06:10,2018-12-06 20:09:14,IP Address,107.77.225.218,100,184,True,2018-12-06 20:09:15,R_2TMFzbJDJH2oWB4,,,,,40.646697998046875,-73.957000732421875,anonymous,EN,Practitioner,Completely Satisfied,Completely Satisfied,"Excellent pacing and clear instruction and objections. ","I don’t enjoy moving around talking to people across the room. ",Completely Satisfied,Completely Satisfied,Same as above,,Completely Satisfied,Completely Satisfied,,,Completely Satisfied,Good agenda with times,,Moderately Satisfied,Moderately Satisfied,,"I’m still a little confused on the differences. ",Somewhat Agree,Strongly Agree
2018-12-06 20:06:20,2018-12-06 20:09:17,IP Address,137.49.65.219,100,176,True,2018-12-06 20:09:17,R_2dR7K3I6vB8p3UC,,,,,41.7899932861328125,-72.745697021484375,anonymous,EN,Practitioner,Completely Satisfied,Completely Satisfied,"Time to work as a school with the actual structures we will be using at our schools (agendas, protocols, etc).  Kept to your time schedule!",,Completely Satisfied,Completely Satisfied,Collaborative time,,Completely Satisfied,Completely Satisfied,Did not know the compass... very helpful and useful to use at our schools,,Completely Satisfied,TIme to work,,Completely Satisfied,Completely Satisfied,,"Great presenter!  Made it humorous, very good explanations",Strongly Agree,Strongly Agree
2018-12-06 20:06:03,2018-12-06 20:09:19,IP Address,137.49.147.234,100,195,True,2018-12-06 20:09:19,R_214VS000JLNocVt,,,,,41.7899932861328125,-72.745697021484375,anonymous,EN,Practitioner,Neutral,Moderately Satisfied,,"repetitive of online course, webinar and reading",Neutral,Moderately Satisfied,walking through example w/ journey presentation,exemplar district too different from HPS,Moderately Satisfied,Completely Satisfied,compass protocol,,Completely Satisfied,Collaborative work around norms,Difficult to find files,Completely Satisfied,Completely Satisfied,Clearer definitions of four terms,Scenarios,Strongly Agree,Neutral
2018-12-06 20:06:56,2018-12-06 20:09:19,IP Address,137.49.151.231,100,142,True,2018-12-06 20:09:19,R_3HB87DMDNMuJCBT,,,,,41.7899932861328125,-72.745697021484375,anonymous,EN,Practitioner,Completely Satisfied,Moderately Satisfied,many opportunities for reflection,,Completely Satisfied,Completely Satisfied,,,Completely Satisfied,Completely Satisfied,,,Completely Satisfied,,,Completely Satisfied,Completely Satisfied,,,Strongly Agree,Strongly Agree
2018-12-06 20:07:52,2018-12-06 20:09:22,IP Address,172.58.229.48,100,90,True,2018-12-06 20:09:22,R_1QgfGgkRAnN6fHp,,,,,41.2091064453125,-73.2086029052734375,anonymous,EN,Practitioner,Completely Satisfied,Completely Satisfied,Meeting w school group,Larger space,Completely Satisfied,Completely Satisfied,Working with school group,,Completely Satisfied,Completely Satisfied,,,Completely Satisfied,,,Completely Satisfied,Completely Satisfied,,,Strongly Agree,Strongly Agree
2018-12-06 20:06:57,2018-12-06 20:09:26,IP Address,174.199.9.44,100,148,True,2018-12-06 20:09:27,R_1hDU7Mv58cI5NNm,,,,,42.3126068115234375,-71.11150360107421875,anonymous,EN,Practitioner,Completely Satisfied,Moderately Satisfied,"The movement in the session. The resources are excellent. ",The session room was too cold,Completely Satisfied,Completely Satisfied,Content and resources,"Temperature of the room ",Moderately Satisfied,Moderately Satisfied,,Room temperature,Completely Satisfied,,,Completely Satisfied,Completely Satisfied,,,Strongly Agree,Strongly Agree
2018-12-06 20:06:57,2018-12-06 20:09:29,IP Address,137.49.183.101,100,151,True,2018-12-06 20:09:29,R_2TRi9PDEDOXfNbO,,,,,41.7899932861328125,-72.745697021484375,anonymous,EN,Practitioner,Completely Satisfied,Completely Satisfied,giving us purpose for the work,"at this time nothing ",Completely Satisfied,Completely Satisfied,,,Moderately Satisfied,Completely Satisfied,,,Completely Satisfied,Gave us an opportunity to discuss ideas around collaborative work.,,Completely Satisfied,Completely Satisfied,,,Somewhat Agree,Strongly Agree
2018-12-06 19:59:45,2018-12-06 20:09:30,IP Address,137.49.132.20,100,584,True,2018-12-06 20:09:31,R_30v4V9vHSKrnHof,,,,,41.7899932861328125,-72.745697021484375,anonymous,EN,Practitioner,Completely Satisfied,Completely Satisfied,Activities - Breakdown of information,,Completely Satisfied,Completely Satisfied,,,Completely Satisfied,Completely Satisfied,,,Completely Satisfied,"As always, time to plan in team is appreciated. The agenda was well strucutred  and guided the learning.",,Completely Satisfied,Completely Satisfied,,,Strongly Agree,Somewhat Agree
2018-12-06 20:06:19,2018-12-06 20:09:32,IP Address,137.49.178.21,100,193,True,2018-12-06 20:09:32,R_2ykfg364UVnYqUW,,,,,41.7899932861328125,-72.745697021484375,anonymous,EN,Practitioner,Completely Satisfied,Completely Satisfied,"gave us needed information efficiently ",n/a,Completely Satisfied,Completely Satisfied,"concise and valuable ",n/a,Completely Satisfied,Completely Satisfied,effective,,Completely Satisfied,"very important and valuable practice ",n/a,Completely Satisfied,Completely Satisfied,easy to follow,,Strongly Agree,Somewhat Agree
2018-12-06 20:06:00,2018-12-06 20:09:32,IP Address,137.49.132.138,100,212,True,2018-12-06 20:09:33,R_1QJG6hkPPizjyLo,,,,,41.7899932861328125,-72.745697021484375,anonymous,EN,Teaching Fellow,Moderately Satisfied,Moderately Satisfied,"Good information, movement around the room to stay active.",,Neutral,Neutral,,,Moderately Satisfied,Neutral,,,Moderately Satisfied,"Working with great colleagues. ",Be sent the correct document/know which document to use to start the session.,Moderately Satisfied,Moderately Satisfied,,,Somewhat Agree,Neutral
